{
  "id": "e08",
  "bozza": true,
  "stagione": 1,
  "episodio": 8,
  "titolo": "testi:e08.titolo",
  "disponibile_se": {},
  "luogo": {
    "x": 86,
    "y": 60
  },
  "introduzione": [
    "testi:e08.intro1",
    "testi:e08.intro2",
    "testi:e08.intro3"
  ],
  "briefing": [
    {
      "testo": "testi:e08.info_dessi",
      "fonte": "dessi",
      "affidabilita": "bassa",
      "vera": false,
      "settore": "strada_cinderwick"
    },
    {
      "testo": "testi:e08.info_radio",
      "fonte": "centrale_radio",
      "affidabilita": "alta",
      "vera": true,
      "settore": "strada_cinderwick"
    },
    {
      "testo": "testi:e08.info_club",
      "fonte": "ufficio_sicurezza_cinderwick",
      "affidabilita": "media",
      "vera": true,
      "settore": "curva_cinderwick"
    },
    {
      "testo": "testi:e08.info_rete",
      "fonte": "voci_in_rete",
      "affidabilita": "media",
      "vera": false,
      "settore": "curva_ospiti"
    }
  ],
  "mappa": {
    "settori": [
      {
        "id": "curva_cinderwick",
        "tipo": "curva",
        "club": "cinderwick_united",
        "pos": {
          "x": 20,
          "y": 35
        }
      },
      {
        "id": "curva_ospiti",
        "tipo": "curva",
        "club": "calderholt_rovers",
        "pos": {
          "x": 82,
          "y": 35
        }
      },
      {
        "id": "piazzale",
        "tipo": "piazzale",
        "pos": {
          "x": 55,
          "y": 62
        }
      },
      {
        "id": "strada_cinderwick",
        "tipo": "strada",
        "pos": {
          "x": 18,
          "y": 84
        }
      },
      {
        "id": "tornelli",
        "tipo": "tornelli",
        "pos": {
          "x": 56,
          "y": 88
        }
      }
    ],
    "risorse": {
      "squadre": {
        "quantita": 4,
        "efficacia": {
          "strada": 2,
          "piazzale": 2,
          "tornelli": 1,
          "curva": 1
        }
      },
      "steward": {
        "quantita": 6,
        "efficacia": {
          "curva": 2,
          "tornelli": 2,
          "piazzale": 1,
          "strada": 1
        }
      },
      "mediatore": {
        "quantita": 1,
        "efficacia": {},
        "dimezza": [
          "corteo"
        ]
      }
    }
  },
  "ondate": [
    {
      "n": 1,
      "titolo": "testi:e08.ondata1",
      "eventi": [
        {
          "id": "corteo8",
          "tipo": "corteo",
          "settore": "strada_cinderwick",
          "pressione": 5
        },
        {
          "id": "arrivi8",
          "tipo": "arrivo",
          "settore": "piazzale",
          "pressione": 3
        },
        {
          "id": "varchi8",
          "tipo": "biglietti",
          "settore": "tornelli",
          "pressione": 2
        }
      ],
      "chiamate": [
        {
          "id": "dessi_chiama",
          "fonte": "dessi",
          "testo": "testi:e08.ch.dessi_chiama",
          "commento": "testi:e08.ch.dessi_chiama.vice",
          "settore": "strada_cinderwick",
          "opzioni": [
            {
              "id": "rispetto_si",
              "testo": "testi:e08.op.rispetto_si",
              "costo": "testi:e08.op.rispetto_si.c",
              "effetti": [
                {
                  "pressione": "strada_cinderwick",
                  "valore": -3
                },
                {
                  "aggiungi": "credito",
                  "valore": -1
                }
              ],
              "risposta": "testi:e08.op.rispetto_si.r"
            },
            {
              "id": "rispetto_no",
              "testo": "testi:e08.op.rispetto_no",
              "costo": "testi:e08.op.rispetto_no.c",
              "effetti": [
                {
                  "aggiungi": "credito",
                  "valore": 1
                },
                {
                  "tensione": "curva_cinderwick",
                  "valore": 2
                }
              ],
              "risposta": "testi:e08.op.rispetto_no.r"
            },
            {
              "id": "mediatore_dessi",
              "testo": "testi:e08.op.mediatore_dessi",
              "costo": "testi:e08.op.mediatore_dessi.c",
              "effetti": [
                {
                  "pressione": "strada_cinderwick",
                  "valore": -2
                },
                {
                  "riserva": "mediatore",
                  "valore": -1
                }
              ],
              "risposta": "testi:e08.op.mediatore_dessi.r"
            }
          ]
        },
        {
          "id": "facce_nuove",
          "fonte": "centrale_radio",
          "testo": "testi:e08.ch.facce_nuove",
          "commento": "testi:e08.ch.facce_nuove.vice",
          "settore": "strada_cinderwick",
          "opzioni": [
            {
              "id": "scorta8",
              "testo": "testi:e08.op.scorta8",
              "costo": "testi:e08.op.scorta8.c",
              "effetti": [
                {
                  "pressione": "strada_cinderwick",
                  "valore": -2
                },
                {
                  "riserva": "squadre",
                  "valore": -1
                }
              ],
              "risposta": "testi:e08.op.scorta8.r"
            },
            {
              "id": "filma",
              "testo": "testi:e08.op.filma",
              "costo": "testi:e08.op.filma.c",
              "effetti": [
                {
                  "aggiungi": "credito",
                  "valore": 1
                },
                {
                  "tensione": "strada_cinderwick",
                  "valore": 1
                }
              ],
              "risposta": "testi:e08.op.filma.r"
            }
          ]
        },
        {
          "id": "quello_la",
          "fonte": "club_ospite",
          "testo": "testi:e08.ch.quello_la",
          "settore": "piazzale",
          "opzioni": [
            {
              "id": "gruppo_si",
              "testo": "testi:e08.op.gruppo_si",
              "costo": "testi:e08.op.gruppo_si.c",
              "effetti": [
                {
                  "pressione": "piazzale",
                  "valore": -2
                },
                {
                  "pressione": "curva_ospiti",
                  "valore": 2
                }
              ],
              "risposta": "testi:e08.op.gruppo_si.r"
            },
            {
              "id": "gruppo_no",
              "testo": "testi:e08.op.gruppo_no",
              "costo": "testi:e08.op.gruppo_no.c",
              "effetti": [
                {
                  "aggiungi": "credito",
                  "valore": -1
                },
                {
                  "pressione": "piazzale",
                  "valore": 1
                }
              ],
              "risposta": "testi:e08.op.gruppo_no.r"
            }
          ]
        },
        {
          "id": "permesso",
          "fonte": "informatore_di_strada",
          "testo": "testi:e08.ch.permesso",
          "commento": "testi:e08.ch.permesso.vice",
          "settore": "tornelli",
          "se": {
            "var": "informatore_pagato",
            "uguale": true
          },
          "opzioni": [
            {
              "id": "cosa_sai",
              "testo": "testi:e08.op.cosa_sai",
              "costo": "testi:e08.op.cosa_sai.c",
              "effetti": [
                {
                  "pressione": "tornelli",
                  "valore": -2
                },
                {
                  "aggiungi": "credito",
                  "valore": -1
                }
              ],
              "risposta": "testi:e08.op.cosa_sai.r"
            },
            {
              "id": "non_ora8",
              "testo": "testi:e08.op.non_ora8",
              "costo": "testi:e08.op.non_ora8.c",
              "effetti": [
                {
                  "pressione": "tornelli",
                  "valore": 1
                }
              ],
              "risposta": "testi:e08.op.non_ora8.r"
            }
          ]
        }
      ]
    },
    {
      "n": 2,
      "titolo": "testi:e08.ondata2",
      "eventi": [
        {
          "id": "cori8c",
          "tipo": "curva",
          "settore": "curva_cinderwick",
          "pressione": 5
        },
        {
          "id": "cori8o",
          "tipo": "curva",
          "settore": "curva_ospiti",
          "pressione": 4
        },
        {
          "id": "piazzale8",
          "tipo": "folla",
          "settore": "piazzale",
          "pressione": 2
        }
      ],
      "chiamate": [
        {
          "id": "coreografia",
          "fonte": "dessi",
          "testo": "testi:e08.ch.coreografia",
          "settore": "curva_cinderwick",
          "opzioni": [
            {
              "id": "accesso_libero",
              "testo": "testi:e08.op.accesso_libero",
              "costo": "testi:e08.op.accesso_libero.c",
              "effetti": [
                {
                  "pressione": "curva_cinderwick",
                  "valore": -3
                },
                {
                  "aggiungi": "credito",
                  "valore": -2
                }
              ],
              "risposta": "testi:e08.op.accesso_libero.r"
            },
            {
              "id": "accesso_steward",
              "testo": "testi:e08.op.accesso_steward",
              "costo": "testi:e08.op.accesso_steward.c",
              "effetti": [
                {
                  "pressione": "curva_cinderwick",
                  "valore": -2
                },
                {
                  "riserva": "steward",
                  "valore": -1
                }
              ],
              "risposta": "testi:e08.op.accesso_steward.r"
            },
            {
              "id": "accesso_no",
              "testo": "testi:e08.op.accesso_no",